{
  "schemaVersion": "stratos-clean-pilot-akb-identity-owner-confirmation-1",
  "revision": "1.0.0",
  "epochId": "clean-pilot-epoch-1",
  "gate": "C5",
  "repository": "AKB/ai-knowledgebase",
  "ownerRole": "akb-owner",
  "identityManifestRevision": "1.0.0",
  "identityManifestSha256": "6646dec58428547ddb669ba25f0c98f52d28c8f8b6fd17e8963d1bd720004886",
  "routeBindingContractRevision": "1.0.0",
  "routeBindingContractSha256": "598b5bdf69025988445d97e8ee3f45afcc68787ab9c9fb2bf74c20116b88ea0d",
  "submissionStatus": "MISSING",
  "authority": "SOURCE_ONLY",
  "productionMutationAuthorized": false,
  "resetAuthorized": false,
  "deployAuthorized": false,
  "unknownIdentityDecision": "STOP",
  "serviceTokenAudiencePolicy": "EXACTLY_ONE_PER_TOKEN",
  "routeScopePolicy": "EXACT_MATCH_REQUIRED",
  "browserServiceTokenReuse": "PROHIBITED",
  "browserRedirectBinding": "RUNTIME_EXACT_MATCH_REQUIRED",
  "entries": [],
  "routeBindings": [],
  "reasonCode": "AKB_OWNER_CONFIRMATION_NOT_SUBMITTED"
}
